{
  "name": "AI Content Automation for YouTube",
  "description": "A free and open-source tool that automates the creation of YouTube content by writing scripts, generating voiceovers, creating videos, and uploading them automatically, enabling hands-free YouTube growth powered by AI.",
  "inputs": [
    {
      "name": "topic",
      "type": "string",
      "description": "The subject or theme for the YouTube video content."
    },
    {
      "name": "script_parameters",
      "type": "object",
      "description": "Parameters or preferences to guide the script writing process (e.g., tone, style, length)."
    },
    {
      "name": "voiceover_settings",
      "type": "object",
      "description": "Settings for voiceover generation such as language, voice type, speed, and pitch."
    },
    {
      "name": "video_assets",
      "type": "list",
      "description": "Visual assets like images or clips or instructions for automatic video generation."
    },
    {
      "name": "upload_credentials",
      "type": "object",
      "description": "Authentication details for YouTube account to enable automatic video upload."
    },
    {
      "name": "upload_metadata",
      "type": "object",
      "description": "Details for the uploaded video such as title, description, tags, and privacy status."
    }
  ],
  "outputs": [
    {
      "name": "script",
      "type": "string",
      "description": "Generated script text for the video content."
    },
    {
      "name": "voiceover_audio",
      "type": "audio file",
      "description": "AI-generated voiceover audio matching the script."
    },
    {
      "name": "video_file",
      "type": "video file",
      "description": "Created video combining voiceover and visual elements."
    },
    {
      "name": "upload_status",
      "type": "object",
      "description": "Result status of the video upload process including success or error details."
    }
  ],
  "patterns": [
    "AI-based text generation for script writing",
    "Text-to-speech synthesis for voiceover creation",
    "Automated video assembly from audio and visual components",
    "YouTube API integration for seamless video uploading",
    "End-to-end content pipeline enabling hands-free operation"
  ],
  "steps": [
    "Accept topic and optional parameters for script generation",
    "Generate a video script using AI text generation models",
    "Convert the script into voiceover audio using AI text-to-speech",
    "Create video by synchronizing voiceover with visual assets or auto-generated footage",
    "Authenticate and upload the finished video to YouTube using API",
    "Return statuses and metadata of created content and upload"
  ],
  "use_cases": [
    "YouTube content creators automating video production",
    "Marketing teams generating video ads or promos rapidly",
    "Educational content automation for video lessons",
    "Small businesses producing frequent video updates without manual editing",
    "Influencers streamlining content creation and publishing workflows"
  ],
  "prompt_templates": [
    {
      "name": "script_generation_prompt",
      "template": "Write a detailed script about the topic: {topic} with style {style} and length {length}."
    },
    {
      "name": "voiceover_generation_prompt",
      "template": "Generate a natural voiceover for the script: {script} using voice type {voice_type} in language {language}."
    },
    {
      "name": "video_creation_prompt",
      "template": "Create a video by combining the voiceover audio: {voiceover_audio} with visual assets according to theme {theme}."
    },
    {
      "name": "upload_video_prompt",
      "template": "Upload the video file {video_file} to YouTube with title '{title}', description '{description}', and tags {tags}."
    }
  ],
  "metadata": {
    "language": "unknown",
    "stars": 852,
    "repo_url": "https://github.com/naqashafzal/AI-Content-Studio"
  }
}