{
  "name": "aaron_marketing_skills",
  "type": "repository_derived_skill",
  "description": "An integrated set of 120 AI-powered marketing skills organized into 8 specialized bot roles across 7 marketing disciplines, offering a contract-based marketing service with 8 audit gates to ensure quality and performance in campaigns.",
  "triggers": [
    "powered",
    "8",
    "across",
    "audit",
    "7",
    "quality",
    "integrated",
    "ensure",
    "120",
    "set",
    "campaigns",
    "bot",
    "disciplines",
    "performance",
    "based",
    "ai",
    "service",
    "specialized",
    "roles",
    "organized",
    "contract",
    "skills",
    "offering",
    "marketing",
    "into",
    "gates",
    "aaron_marketing_skills"
  ],
  "inputs": [
    {
      "name": "marketing_objective",
      "type": "string",
      "description": "The main marketing goal to achieve, e.g., brand awareness, lead generation, or product launch."
    },
    {
      "name": "target_audience_data",
      "type": "object",
      "description": "Demographic, behavioral, and geographic data defining the target audience."
    },
    {
      "name": "content_assets",
      "type": "string",
      "description": "Marketing content such as narratives, SEO keywords, social posts, email drafts, paid ads, influencer outlines, or launch plans."
    },
    {
      "name": "performance_metrics",
      "type": "object",
      "description": "Metrics related to engagement, conversion, ROAS, and other KPIs for auditing marketing activities."
    }
  ],
  "outputs": [
    {
      "name": "marketing_strategy",
      "type": "object",
      "description": "A comprehensive strategy covering narrative, SEO/GEO, social media, email, paid advertising, influencer marketing, and launch plans."
    },
    {
      "name": "audit_report",
      "type": "object",
      "description": "Evaluation reports from auditor gates: TALE, CORE-EEAT, CITE, ECHO, SEND, ROAS, STAR, RAMP assessing quality and effectiveness."
    },
    {
      "name": "actionable_recommendations",
      "type": "string",
      "description": "Suggestions and improvements for ongoing marketing campaigns and content."
    }
  ],
  "steps": [
    "Define marketing objectives and gather audience data",
    "Generate or refine content assets across key marketing disciplines using AI bots",
    "Execute coordinated marketing activities including narrative, SEO/GEO, social, email, paid, influencer, and launch campaigns",
    "Apply auditor gates (TALE, CORE-EEAT, CITE, ECHO, SEND, ROAS, STAR, RAMP) to assess content quality and campaign performance",
    "Compile audit reports and derive actionable recommendations",
    "Iterate marketing efforts based on audit feedback and performance analytics"
  ],
  "use_cases": [
    "Deploying a comprehensive AI marketing team to plan and execute multi-channel campaigns",
    "Auditing and improving existing marketing strategies and content quality",
    "Automating end-to-end marketing workflow with AI-powered specialized bots",
    "Scaling marketing efforts using a portable skill set across industries and products",
    "Contracting AI marketing expertise for short or long-term marketing projects"
  ],
  "patterns": [
    "Modular AI bot roles specialized by marketing disciplines",
    "Multi-discipline integrated marketing workflow",
    "Use of auditor gates for continuous quality and performance auditing",
    "Contract-based unified service model",
    "Skill portability across projects and teams"
  ],
  "prompt_templates": [
    {
      "name": "generate_narrative",
      "template": "Create a compelling marketing narrative for the product targeting {target_audience} focusing on {key_benefits}."
    },
    {
      "name": "seo_optimization",
      "template": "Generate SEO and GEO keywords and content suggestions to improve search rankings for {market_segment}."
    },
    {
      "name": "social_media_campaign",
      "template": "Develop a social media campaign plan tailored for {platforms} to increase engagement among {target_audience}."
    },
    {
      "name": "email_marketing_sequence",
      "template": "Create an email marketing sequence for {campaign_purpose} including subject lines, body content, and CTAs."
    },
    {
      "name": "paid_ad_strategy",
      "template": "Recommend a paid advertising strategy with budget allocation and targeting criteria for {product}."
    },
    {
      "name": "influencer_marketing_plan",
      "template": "Outline an influencer marketing plan targeting {influencer_types} to promote {brand}."
    },
    {
      "name": "launch_plan",
      "template": "Develop a step-by-step launch plan for {product_or_service} including timelines and key activities."
    },
    {
      "name": "audit_gate_evaluation",
      "template": "Evaluate marketing materials against the {gate_name} audit criteria and provide improvement suggestions."
    }
  ],
  "metadata": {
    "language": "unknown",
    "stars": 3013,
    "repo_url": "https://github.com/aaron-he-zhu/aaron-marketing-skills"
  },
  "source": {
    "repo_name": "aaron-marketing-skills",
    "repo_url": "https://github.com/aaron-he-zhu/aaron-marketing-skills"
  }
}