{
  "name": "free_ai_social_media_scheduler",
  "type": "repository_derived_skill",
  "description": "Free open-source AI social media scheduler — self-hostable alternative to Postiz, Buffer, and Hootsuite with built-in AI content generation.",
  "triggers": [
    "postiz",
    "content",
    "free",
    "alternative",
    "hostable",
    "media",
    "buffer",
    "generation",
    "self",
    "open",
    "source",
    "scheduler",
    "hootsuite",
    "built",
    "ai",
    "social"
  ],
  "inputs": [
    {
      "name": "repository_context",
      "type": "string",
      "description": "Repository context or summary to analyze"
    },
    {
      "name": "user_goal",
      "type": "string",
      "description": "User goal for extracting reusable patterns"
    }
  ],
  "outputs": [
    {
      "name": "reusable_patterns",
      "type": "array",
      "description": "Reusable patterns identified from the repository"
    },
    {
      "name": "suggested_actions",
      "type": "array",
      "description": "Suggested follow-up actions based on the analysis"
    }
  ],
  "steps": [
    "analyze_repository_metadata",
    "extract_reusable_patterns",
    "map_patterns_to_marketing_use_cases"
  ],
  "use_cases": [
    "marketing automation",
    "workflow design",
    "prompt generation"
  ],
  "patterns": [],
  "prompt_templates": [],
  "metadata": {
    "language": "unknown",
    "stars": 2079,
    "repo_url": "https://github.com/Anil-matcha/Free-AI-Social-Media-Scheduler"
  },
  "source": {
    "repo_name": "Free-AI-Social-Media-Scheduler",
    "repo_url": "https://github.com/Anil-matcha/Free-AI-Social-Media-Scheduler"
  }
}