{
  "name": "openoutreach",
  "type": "repository_derived_skill",
  "description": "An open-source, self-hosted AI agent designed to generate B2B leads by analyzing product descriptions, identifying fitting leads, explaining relevance, and emailing prospects directly from the user's mailbox via a command-line interface.",
  "triggers": [
    "ai",
    "line",
    "open",
    "product",
    "via",
    "agent",
    "prospects",
    "self",
    "relevance",
    "leads",
    "identifying",
    "mailbox",
    "interface",
    "explaining",
    "s",
    "analyzing",
    "b2b",
    "hosted",
    "openoutreach",
    "user",
    "command",
    "descriptions",
    "source",
    "directly",
    "designed",
    "emailing",
    "generate",
    "fitting"
  ],
  "inputs": [
    {
      "name": "product_description",
      "type": "string",
      "description": "A detailed description of the user's product or service used to identify matching leads."
    },
    {
      "name": "mailbox_credentials",
      "type": "object",
      "description": "Authentication details (e.g., username, password, API key) for the user's email mailbox to send outreach emails."
    },
    {
      "name": "lead_criteria",
      "type": "object",
      "description": "Additional filtering parameters or attributes defining the characteristics of ideal leads."
    },
    {
      "name": "email_template",
      "type": "string",
      "description": "Template for the outreach email content, which may include placeholders to be dynamically filled."
    }
  ],
  "outputs": [
    {
      "name": "lead_list",
      "type": "array",
      "description": "A collection of identified leads with profiles matching the product description and criteria."
    },
    {
      "name": "lead_explanations",
      "type": "array",
      "description": "Explanations justifying why each identified lead fits the described product."
    },
    {
      "name": "sent_emails_report",
      "type": "object",
      "description": "A report summarizing the status and details of emails sent to the identified leads."
    }
  ],
  "steps": [
    "User inputs a detailed product description and optional lead criteria.",
    "AI agent analyzes the product description to identify suitable leads matching the profile.",
    "For each lead, the agent generates explanations describing why the lead fits the product.",
    "User configures mailbox credentials and email templates for outreach.",
    "The system sends personalized emails to each lead from the user's mailbox.",
    "Agent provides a status report on the outreach emails sent."
  ],
  "use_cases": [
    "Startups seeking targeted B2B leads for new product launches.",
    "Sales teams automating personalized outreach at scale.",
    "Marketing departments improving lead quality with AI insights.",
    "Businesses wanting a self-hosted, privacy-focused lead generation tool."
  ],
  "patterns": [
    "AI-driven lead identification from product descriptions",
    "Contextual explanation generation for lead relevance",
    "Automated personalized email generation and delivery",
    "Command-line interface for self-hosted deployment"
  ],
  "prompt_templates": [
    {
      "name": "lead_identification_prompt",
      "template": "Describe your product: {product_description}. Find leads that fit this description."
    },
    {
      "name": "lead_explanation_prompt",
      "template": "Explain why this person is a good fit: {lead_profile} for the product described as {product_description}."
    },
    {
      "name": "email_generation_prompt",
      "template": "Generate a personalized outreach email for lead {lead_name} based on the following template: {email_template}."
    }
  ],
  "metadata": {
    "language": "unknown",
    "stars": 3327,
    "repo_url": "https://github.com/eracle/OpenOutreach"
  },
  "source": {
    "repo_name": "OpenOutreach",
    "repo_url": "https://github.com/eracle/OpenOutreach"
  }
}