{
  "name": "ai_marketing_skills",
  "type": "repository_derived_skill",
  "description": "A collection of open-source AI-driven marketing skills focused on enabling growth experiments, managing sales pipelines, optimizing content operations, executing outbound marketing, enhancing SEO, and automating finance-related marketing tasks.",
  "triggers": [
    "source",
    "growth",
    "enhancing",
    "executing",
    "marketing",
    "enabling",
    "open",
    "driven",
    "tasks",
    "focused",
    "experiments",
    "seo",
    "operations",
    "pipelines",
    "ai_marketing_skills",
    "ai",
    "finance",
    "skills",
    "outbound",
    "sales",
    "automating",
    "content",
    "managing",
    "collection",
    "optimizing",
    "related"
  ],
  "inputs": [
    {
      "name": "marketing_data",
      "type": "varied (text, CSV, JSON)",
      "description": "Raw or processed marketing data including customer information, campaign metrics, content details, finance reports, and sales data to be used for experiments and automation."
    },
    {
      "name": "experiment_parameters",
      "type": "JSON or dictionary",
      "description": "Configuration parameters and hypotheses for growth experiments or marketing strategies."
    },
    {
      "name": "content_inputs",
      "type": "string",
      "description": "Text or keywords for content creation, optimization, or SEO enhancement."
    },
    {
      "name": "outbound_targets",
      "type": "list of strings",
      "description": "List of outbound marketing targets such as email addresses or contact profiles."
    },
    {
      "name": "sales_pipeline_data",
      "type": "structured data",
      "description": "Information about sales stages, leads, and opportunities to manage and optimize the sales pipeline."
    },
    {
      "name": "finance_data",
      "type": "structured data or documents",
      "description": "Financial information related to marketing budgets, ROI, and automation tasks."
    }
  ],
  "outputs": [
    {
      "name": "experiment_results",
      "type": "JSON or report",
      "description": "Results and insights from growth experiments and marketing tactic evaluations."
    },
    {
      "name": "optimized_content",
      "type": "string",
      "description": "Generated or improved marketing content ready for deployment."
    },
    {
      "name": "seo_recommendations",
      "type": "list of strings",
      "description": "Suggestions to enhance search engine optimization for target websites or content."
    },
    {
      "name": "outbound_campaigns",
      "type": "structured messages or plans",
      "description": "Prepared outbound marketing communications and engagement plans."
    },
    {
      "name": "sales_insights",
      "type": "dashboard or report",
      "description": "Analytics and insights for effective sales pipeline management."
    },
    {
      "name": "automation_actions",
      "type": "task execution logs or confirmations",
      "description": "Records or confirmations of automated finance or marketing operations."
    }
  ],
  "steps": [
    "Collect and preprocess marketing, sales, content, and finance data inputs",
    "Configure experiment parameters or campaign strategies",
    "Execute AI-powered experiments or run automations for content, sales, SEO, outbound, or finance tasks",
    "Analyze outputs and generate reports or actionable recommendations",
    "Deploy optimized marketing content and campaigns",
    "Continuously monitor and update based on experiment results and automation feedback"
  ],
  "use_cases": [
    "Running growth experiments to validate marketing hypotheses and improve ROI",
    "Automating sales pipeline management to increase efficiency and track leads",
    "Generating SEO-friendly content to boost organic traffic",
    "Executing outbound marketing campaigns with personalized AI-driven messaging",
    "Automating finance-related marketing processes including budget tracking and ROI analysis"
  ],
  "patterns": [
    "AI-driven A/B and multivariate growth experiments",
    "Automated sales pipeline tracking and lead scoring",
    "Content generation and optimization with NLP techniques",
    "Outbound marketing automation and personalized messaging",
    "SEO analytics and keyword optimization",
    "Finance automation for marketing budget and ROI management"
  ],
  "prompt_templates": [
    {
      "name": "growth_experiment_setup",
      "template": "Design a growth experiment for {campaign_name} targeting {audience} with goals {goals_list}."
    },
    {
      "name": "seo_optimization_prompt",
      "template": "Suggest SEO improvements for the content related to {topic} focusing on keywords {keywords}."
    },
    {
      "name": "outbound_message_generator",
      "template": "Create a personalized outbound email message for {contact_name} from {company_name} about {product_or_service}."
    },
    {
      "name": "sales_pipeline_update",
      "template": "Update the sales pipeline status for lead {lead_name} with current stage {stage} and next steps {next_steps}."
    },
    {
      "name": "finance_automation_task",
      "template": "Automate the marketing finance process for budget {budget_amount} and track ROI from campaigns {campaign_list}."
    }
  ],
  "metadata": {
    "language": "unknown",
    "stars": 2374,
    "repo_url": "https://github.com/ericosiu/ai-marketing-skills"
  },
  "source": {
    "repo_name": "ai-marketing-skills",
    "repo_url": "https://github.com/ericosiu/ai-marketing-skills"
  }
}