{
  "name": "Free-AI-Social-Media-Scheduler",
  "description": "Free open-source AI social media scheduler — self-hostable alternative to Postiz, Buffer, and Hootsuite with built-in AI content generation.",
  "inputs": [],
  "outputs": [],
  "patterns": [
    "pattern_extraction_pending",
    "workflow_identification_pending"
  ],
  "steps": [
    "analyze_repository_metadata",
    "extract_reusable_patterns",
    "map_patterns_to_marketing_use_cases"
  ],
  "use_cases": [
    "marketing automation",
    "workflow design",
    "prompt generation"
  ],
  "prompt_templates": [],
  "metadata": {
    "language": "unknown",
    "stars": 2079,
    "repo_url": "https://github.com/Anil-matcha/Free-AI-Social-Media-Scheduler"
  }
}