{
  "name": "claude_skills",
  "type": "repository_derived_skill",
  "description": "A comprehensive collection of 329 code and agent skills, 30+ agents, 70+ custom commands, and 320+ customizable scripts and references designed to extend and empower multiple AI coding agents including Claude Code, Codex, Gemini CLI, and Cursor. It supports diverse domains such as engineering, marketing, product management, compliance, advisory (C-level), research, business operations, commercial, finance, and productivity.",
  "triggers": [
    "collection",
    "cursor",
    "supports",
    "custom",
    "70",
    "ai",
    "agents",
    "30",
    "advisory",
    "skills",
    "compliance",
    "research",
    "business",
    "cli",
    "extend",
    "operations",
    "level",
    "marketing",
    "designed",
    "320",
    "empower",
    "product",
    "domains",
    "329",
    "c",
    "claude",
    "agent",
    "management",
    "coding",
    "finance",
    "references",
    "commands",
    "commercial",
    "scripts",
    "multiple",
    "including",
    "diverse",
    "claude_skills",
    "such",
    "customizable",
    "gemini",
    "productivity",
    "code",
    "codex",
    "comprehensive",
    "engineering"
  ],
  "inputs": [
    {
      "name": "agent_input",
      "type": "string",
      "description": "Input queries, commands, or prompts provided to the AI coding agents leveraging the skills."
    },
    {
      "name": "custom_command",
      "type": "string",
      "description": "User-defined commands that can be integrated into agents for specific tasks."
    },
    {
      "name": "reference_data",
      "type": "object",
      "description": "Configurable reference materials or context data used by skills and scripts."
    }
  ],
  "outputs": [
    {
      "name": "skill_response",
      "type": "string",
      "description": "Processed output, solution, or response generated by an AI agent executing the relevant skill or command."
    },
    {
      "name": "script_result",
      "type": "object",
      "description": "Result or effect produced by running customizable scripts within an agent context."
    }
  ],
  "steps": [
    "Select or initialize an AI coding agent supported by the repository (e.g., Claude Code, Codex)",
    "Load relevant skills, custom commands, and references tailored to the task domain",
    "Provide input queries or commands to the agent utilizing the loaded skills",
    "Agent processes input leveraging scripts, commands, and references",
    "Receive and utilize outputs generated by the agent for decision making or automation",
    "Iterate customization of commands and references to refine agent capabilities and productivity"
  ],
  "use_cases": [
    "Automating coding tasks across multiple AI coding agents",
    "Building custom agent workflows for engineering and product management",
    "Enhancing compliance and finance advisory processes using AI",
    "Augmenting research, marketing, and business operations with AI skillsets",
    "Boosting daily productivity through AI-driven command execution and scripting"
  ],
  "patterns": [
    "Modular skill and agent architecture enabling plug-and-play custom commands and references",
    "Cross-agent compatibility supporting Claude Code, Codex, Gemini CLI, Cursor and others",
    "Domain-specific customization for technical and operational use cases",
    "Integration of advisory and professional roles into AI-driven workflows",
    "Use of scripts and references for enhancing agent intelligence and task execution"
  ],
  "prompt_templates": [
    {
      "name": "skill_invocation",
      "template": "Execute the skill for {task_description} using agent {agent_name} with input: {agent_input}"
    },
    {
      "name": "custom_command_execution",
      "template": "Run the custom command '{custom_command}' with parameters {parameters} on agent {agent_name}"
    },
    {
      "name": "reference_based_query",
      "template": "Using reference data {reference_name}, respond to: {query}"
    }
  ],
  "metadata": {
    "language": "unknown",
    "stars": 16065,
    "repo_url": "https://github.com/alirezarezvani/claude-skills"
  },
  "source": {
    "repo_name": "claude-skills",
    "repo_url": "https://github.com/alirezarezvani/claude-skills"
  }
}