{
  "name": "seo-geo-claude-skills",
  "description": "20 SEO & GEO skills for Claude Code, Cursor, Codex, and 35+ AI agents. Keyword research, content writing, technical audits, rank tracking. CORE-EEAT + CITE frameworks.",
  "inputs": [],
  "outputs": [],
  "patterns": [
    "pattern_extraction_pending",
    "workflow_identification_pending"
  ],
  "steps": [
    "analyze_repository_metadata",
    "extract_reusable_patterns",
    "map_patterns_to_marketing_use_cases"
  ],
  "use_cases": [
    "marketing automation",
    "workflow design",
    "prompt generation"
  ],
  "prompt_templates": [],
  "metadata": {
    "language": "unknown",
    "stars": 2038,
    "repo_url": "https://github.com/aaron-he-zhu/seo-geo-claude-skills"
  }
}