{
  "name": "marketingskills",
  "type": "repository_derived_skill",
  "description": "A set of marketing skills and capabilities tailored for Claude AI Code and AI agents, focused on conversion rate optimization (CRO), copywriting, SEO, analytics, and growth engineering to enhance marketing performance.",
  "triggers": [
    "ai",
    "claude",
    "skills",
    "analytics",
    "conversion",
    "enhance",
    "focused",
    "cro",
    "seo",
    "performance",
    "optimization",
    "growth",
    "marketingskills",
    "agents",
    "capabilities",
    "tailored",
    "engineering",
    "marketing",
    "rate",
    "copywriting",
    "code",
    "set"
  ],
  "inputs": [
    {
      "name": "marketing_data",
      "type": "text or structured data",
      "description": "Raw or processed marketing data including website content, campaign details, keywords, analytics metrics, and campaign goals."
    },
    {
      "name": "campaign_objectives",
      "type": "string",
      "description": "Specific marketing goals such as increasing conversion rates, improving SEO rankings, or generating copy."
    },
    {
      "name": "user_query",
      "type": "string",
      "description": "Natural language queries or instructions related to marketing tasks."
    }
  ],
  "outputs": [
    {
      "name": "optimized_marketing_content",
      "type": "string",
      "description": "Generated or enhanced content such as copywriting outputs or SEO optimizations tailored to the input goals."
    },
    {
      "name": "analytics_report",
      "type": "structured data or text",
      "description": "Insights and reports derived from marketing analytics data to inform growth decisions."
    },
    {
      "name": "growth_recommendations",
      "type": "string",
      "description": "Actionable strategies and growth engineering suggestions based on data analysis and CRO."
    }
  ],
  "steps": [
    "Collect and input relevant marketing data and objectives",
    "Analyze data to identify strengths, weaknesses, and opportunities",
    "Apply AI models to generate or optimize marketing content and SEO",
    "Produce analytics reports to support data-driven decisions",
    "Iterate on campaigns using feedback and performance data for CRO",
    "Implement growth engineering strategies to maximize marketing ROI"
  ],
  "use_cases": [
    "Generating high-conversion marketing copy for digital campaigns",
    "Optimizing website or content SEO to improve search rankings",
    "Analyzing campaign data to produce actionable growth strategies",
    "Automating marketing tasks for AI-driven agents using Claude Code",
    "Supporting analytics-driven marketing decision-making processes"
  ],
  "patterns": [
    "Conversion Rate Optimization (CRO) iterative testing and improvement",
    "AI-driven copywriting generation and refinement",
    "SEO keyword analysis and content optimization",
    "Data analytics to inform marketing strategy",
    "Growth engineering tactics for scaling marketing impact"
  ],
  "prompt_templates": [
    {
      "name": "copywriting_generate",
      "template": "Create persuasive marketing copy for a product that focuses on {product_features} targeting {audience} with the goal of {campaign_objective}."
    },
    {
      "name": "seo_optimization",
      "template": "Analyze the following content for SEO improvements targeting keywords: {keywords}. Suggest optimizations."
    },
    {
      "name": "analytics_insights",
      "template": "Provide an analytics summary and growth recommendations based on the following marketing data: {marketing_data}."
    },
    {
      "name": "cro_testing_plan",
      "template": "Generate a CRO testing plan to improve conversion rate for the campaign focused on {campaign_objective}."
    }
  ],
  "metadata": {
    "language": "unknown",
    "stars": 55345,
    "repo_url": "https://github.com/coreyhaines31/marketingskills"
  },
  "source": {
    "repo_name": "marketingskills",
    "repo_url": "https://github.com/coreyhaines31/marketingskills"
  }
}