{
  "name": "bilingual_ai_prompt_library",
  "description": "A practical bilingual AI prompt library designed to support prompt engineering for tasks involving work, learning, content creation, marketing, and everyday applications.",
  "inputs": [
    {
      "name": "task_description",
      "type": "string",
      "description": "Description of the task or scenario for which a prompt is needed."
    },
    {
      "name": "language_preference",
      "type": "string",
      "description": "Preferred language for the prompt output (e.g., English or Chinese)."
    },
    {
      "name": "context_data",
      "type": "string",
      "description": "Additional context or information to customize the prompt for specific needs."
    }
  ],
  "outputs": [
    {
      "name": "ai_prompt",
      "type": "string",
      "description": "Generated bilingual AI prompt tailored for the specified task and context."
    }
  ],
  "patterns": [
    "Bilingual prompt construction pattern",
    "Domain-specific prompt templates for work, learning, marketing, and content creation",
    "Contextual prompt customization technique"
  ],
  "steps": [
    "Identify the user's task or scenario requiring an AI prompt.",
    "Select or adapt a bilingual prompt template relevant to the task domain.",
    "Insert contextual information and language preference into the prompt template placeholders.",
    "Generate the customized AI prompt formatted for bilingual usage.",
    "Deliver the prompt for application in AI models or workflows."
  ],
  "use_cases": [
    "Creating effective AI prompts for bilingual marketing campaigns.",
    "Generating educational prompts in both English and Chinese for learning applications.",
    "Assisting content creators to produce bilingual text prompts for writing or ideation.",
    "Facilitating daily work-related AI prompt engineering across languages."
  ],
  "prompt_templates": [
    {
      "name": "marketing_campaign_prompt",
      "template": "Create a bilingual marketing message in {language_preference} that highlights {context_data}."
    },
    {
      "name": "educational_content_prompt",
      "template": "Generate a bilingual educational explanation about {context_data} suitable for learners."
    },
    {
      "name": "content_creation_prompt",
      "template": "Write a bilingual creative text involving {context_data} for content generation."
    },
    {
      "name": "work_task_prompt",
      "template": "Formulate a bilingual prompt to assist with {context_data} in a professional setting."
    }
  ],
  "metadata": {
    "language": "unknown",
    "stars": 2817,
    "repo_url": "https://github.com/yaojingang/yao-open-prompts"
  }
}