{
  "name": "alwrity",
  "type": "repository_derived_skill",
  "description": "An AI-driven digital marketing platform providing content strategy and planning, multimodal content generation, publishing, analytics, SEO optimization, and social account management to streamline marketing operations.",
  "triggers": [
    "seo",
    "alwrity",
    "content",
    "platform",
    "management",
    "account",
    "operations",
    "ai",
    "social",
    "driven",
    "multimodal",
    "optimization",
    "digital",
    "planning",
    "strategy",
    "generation",
    "streamline",
    "publishing",
    "marketing",
    "analytics",
    "providing"
  ],
  "inputs": [
    {
      "name": "marketing_goals",
      "type": "string",
      "description": "High-level marketing objectives or campaign goals."
    },
    {
      "name": "content_brief",
      "type": "string",
      "description": "Detailed description of content requirements or topics."
    },
    {
      "name": "existing_content_data",
      "type": "text/media",
      "description": "Current marketing content in various formats for analysis and enhancement."
    },
    {
      "name": "social_media_accounts",
      "type": "list",
      "description": "User's connected social media accounts for management and publishing."
    },
    {
      "name": "seo_keywords",
      "type": "list",
      "description": "Keywords targeted for AI-powered SEO optimization."
    },
    {
      "name": "performance_metrics",
      "type": "data",
      "description": "Campaign or published content metrics for AI analytics and insights."
    }
  ],
  "outputs": [
    {
      "name": "content_strategy_plan",
      "type": "document",
      "description": "AI-generated strategic plan for digital marketing content."
    },
    {
      "name": "multimodal_content",
      "type": "text/images/videos",
      "description": "Generated content in various formats such as text, images, and videos for marketing use."
    },
    {
      "name": "published_content_report",
      "type": "report",
      "description": "Summary and status of published content across platforms."
    },
    {
      "name": "analytics_dashboard",
      "type": "visualization",
      "description": "Data-driven insights and metrics visualizations to track marketing effectiveness."
    },
    {
      "name": "seo_recommendations",
      "type": "list",
      "description": "Suggested optimizations based on AI SEO analysis."
    },
    {
      "name": "social_account_management_status",
      "type": "status/log",
      "description": "Information about connected social accounts, publishing schedules, and engagement."
    }
  ],
  "steps": [
    "Define marketing objectives and input content requirements.",
    "Leverage AI to generate a content strategy and planning document.",
    "Produce multimodal marketing content tailored to the strategy.",
    "Connect and synchronize social media accounts for content publishing.",
    "Publish content via integrated channels with scheduling capabilities.",
    "Collect and analyze performance data with the analytics module.",
    "Generate SEO recommendations using AI insights to improve content reach.",
    "Iterate on strategy and content based on analytics and market response."
  ],
  "use_cases": [
    "Developing an AI-based content marketing plan for new product launches.",
    "Automating creation and publishing of diverse marketing materials.",
    "Optimizing existing content for better search engine rankings using AI insights.",
    "Managing multiple social media accounts and scheduling posts from one platform.",
    "Tracking campaign performance and making data-driven marketing decisions."
  ],
  "patterns": [
    "AI-driven content strategy generation",
    "Multimodal content synthesis (text, image, video)",
    "Automated publishing workflows",
    "Real-time analytics and reporting",
    "AI-enhanced SEO optimization",
    "Social media account integration and management"
  ],
  "prompt_templates": [
    {
      "name": "content_strategy_generation",
      "template": "Create a digital marketing content strategy targeting {marketing_goals} with focus on {content_brief}."
    },
    {
      "name": "multimodal_content_creation",
      "template": "Generate {content_type} content based on the strategy: {content_strategy_plan}."
    },
    {
      "name": "seo_optimization_prompt",
      "template": "Analyze the content for SEO opportunities focusing on these keywords: {seo_keywords}."
    },
    {
      "name": "analytics_insight_request",
      "template": "Provide performance insights and recommendations for the campaign data: {performance_metrics}."
    },
    {
      "name": "social_media_publish_schedule",
      "template": "Schedule publishing of content titled '{content_title}' across connected social media accounts on {publish_date}."
    }
  ],
  "metadata": {
    "language": "unknown",
    "stars": 1202,
    "repo_url": "https://github.com/ALwrity/ALwrity"
  },
  "source": {
    "repo_name": "ALwrity",
    "repo_url": "https://github.com/ALwrity/ALwrity"
  }
}