{
  "name": "AI-Driven Digital Marketing Platform",
  "description": "A comprehensive AI-first platform providing content strategy and planning, multimodal content generation, publishing, analytics, AI-powered SEO, and management of connected social accounts for digital marketing.",
  "inputs": [
    {
      "name": "marketing_goals",
      "type": "string",
      "description": "Objectives or goals defined by the user for the marketing campaign."
    },
    {
      "name": "content_parameters",
      "type": "object",
      "description": "Specifications for content generation including format, topic, tone, and length."
    },
    {
      "name": "social_account_credentials",
      "type": "object",
      "description": "Authentication data to connect and manage user social media accounts."
    },
    {
      "name": "analytics_data",
      "type": "object",
      "description": "Data collected from published content and social accounts for performance tracking."
    },
    {
      "name": "seo_keywords",
      "type": "list",
      "description": "Keywords or phrases used as input to optimize content for search engines."
    }
  ],
  "outputs": [
    {
      "name": "content_strategy_plan",
      "type": "object",
      "description": "AI-generated detailed plan for content creation and marketing roadmap."
    },
    {
      "name": "generated_content",
      "type": "multimodal",
      "description": "Text, images, videos, or other content formats produced for marketing purposes."
    },
    {
      "name": "published_content_status",
      "type": "object",
      "description": "Status and metadata of content after being published on various platforms."
    },
    {
      "name": "marketing_analytics_report",
      "type": "object",
      "description": "Insights and performance analytics derived from campaign data."
    },
    {
      "name": "seo_optimization_suggestions",
      "type": "object",
      "description": "Recommendations to improve search engine ranking and visibility."
    }
  ],
  "patterns": [
    "AI-powered content ideation and planning",
    "Multimodal content generation (text, images, video)",
    "Automated publishing workflows",
    "Social media account integration and management",
    "Data-driven marketing analytics",
    "AI-enhanced SEO optimization"
  ],
  "steps": [
    "Define marketing goals and campaign objectives",
    "Generate AI-based content strategy and planning roadmap",
    "Create multimodal marketing content based on strategy",
    "Publish content across connected social media and digital platforms",
    "Collect and analyze performance data from campaigns",
    "Generate actionable SEO recommendations and refine strategies",
    "Manage and adjust social account connections and content scheduling"
  ],
  "use_cases": [
    "Automating digital marketing content creation and publication",
    "Developing data-driven, AI-enhanced content strategies",
    "Optimizing content for SEO with AI insights",
    "Managing multiple social media accounts from a single platform",
    "Tracking and analyzing marketing campaign effectiveness with AI analytics"
  ],
  "prompt_templates": [
    {
      "name": "content_strategy_prompt",
      "template": "Generate a content strategy plan for the marketing goals: {marketing_goals}"
    },
    {
      "name": "content_generation_prompt",
      "template": "Create {content_parameters.format} content about {content_parameters.topic} with a {content_parameters.tone} tone and {content_parameters.length} length."
    },
    {
      "name": "seo_optimization_prompt",
      "template": "Provide SEO optimization suggestions based on these keywords: {seo_keywords}"
    },
    {
      "name": "analytics_summary_prompt",
      "template": "Summarize insights and performance from this campaign data: {analytics_data}"
    }
  ],
  "metadata": {
    "language": "unknown",
    "stars": 1195,
    "repo_url": "https://github.com/ALwrity/ALwrity"
  }
}