{
  "name": "seo_geo_claude_skills",
  "type": "repository_derived_skill",
  "description": "20 SEO & GEO skills for Claude Code, Cursor, Codex, and 35+ AI agents. Keyword research, content writing, technical audits, rank tracking. CORE-EEAT + CITE frameworks.",
  "triggers": [
    "code",
    "eeat",
    "skills",
    "35",
    "cite",
    "frameworks",
    "technical",
    "writing",
    "content",
    "tracking",
    "agents",
    "claude",
    "keyword",
    "20",
    "seo",
    "cursor",
    "codex",
    "rank",
    "geo",
    "audits",
    "core",
    "ai",
    "research"
  ],
  "inputs": [
    {
      "name": "repository_context",
      "type": "string",
      "description": "Repository context or summary to analyze"
    },
    {
      "name": "user_goal",
      "type": "string",
      "description": "User goal for extracting reusable patterns"
    }
  ],
  "outputs": [
    {
      "name": "reusable_patterns",
      "type": "array",
      "description": "Reusable patterns identified from the repository"
    },
    {
      "name": "suggested_actions",
      "type": "array",
      "description": "Suggested follow-up actions based on the analysis"
    }
  ],
  "steps": [
    "analyze_repository_metadata",
    "extract_reusable_patterns",
    "map_patterns_to_marketing_use_cases"
  ],
  "use_cases": [
    "marketing automation",
    "workflow design",
    "prompt generation"
  ],
  "patterns": [],
  "prompt_templates": [],
  "metadata": {
    "language": "unknown",
    "stars": 2038,
    "repo_url": "https://github.com/aaron-he-zhu/seo-geo-claude-skills"
  },
  "source": {
    "repo_name": "seo-geo-claude-skills",
    "repo_url": "https://github.com/aaron-he-zhu/seo-geo-claude-skills"
  }
}